{
  "schema_version": "0.1",
  "plan_id": "11111111-1111-4111-8111-111111111111",
  "revision": 1,
  "plan_type": "course",
  "operation": "create",
  "title": "Create Foundations of AI",
  "summary": "Create the initial course plan from the supplied syllabus.",
  "warnings": [],
  "assumptions": [],
  "content": {}
}
