{
  "schema_version": "0.1",
  "plan_id": "11111111-1111-4111-8111-111111111111",
  "revision": 2,
  "plan_type": "course",
  "operation": "create",
  "title": "Create Foundations of AI",
  "summary": "Revise the initial course plan before preview.",
  "warnings": [],
  "assumptions": [
    "The syllabus topics determine the proposed section sequence."
  ],
  "content": {}
}
